cityName,Content,Gender,nackName,Score,Time,userLevel,tagList
唐山,期待很高，但是看到的不像期待的那么好，不过也还是不错吧，尤其是推理的情节也是很好看的。,null,Gxp736256645,3,2021-02-18 18:00,1,"{'fixed': [{'id': 4, 'name': '购票'}]}"
厦门,结尾因为赶时间没有看完。,null,Chougx,3.5,2021-02-18 18:00,2,"{'fixed': [{'id': 4, 'name': '购票'}]}"
天津,只能说一般般 什么都一般般 可能是期待太高了  有点失望,null,努力的娜七七,2.5,2021-02-18 18:00,2,"{'fixed': [{'id': 4, 'name': '购票'}]}"
镇雄县,这一个多小时，表示很难坐啊！,2,辰乐,0.5,2021-02-18 18:00,1,"{'fixed': [{'id': 2, 'name': '购票差评'}, {'id': 4, 'name': '购票'}]}"
建湖,最多7分，想给8分都觉得亏。搞笑生硬，案件不咋地。陈导多了一年时间都没剪辑好？,1,我啊早几点,3.5,2021-02-18 18:00,2,"{'fixed': [{'id': 4, 'name': '购票'}]}"
徐州,挺搞笑的，感觉还行,null,胡志军的自拍,3.5,2021-02-18 18:00,1,null
包头,剧情严谨 画面优质 演技非常奈斯,2,颜槿川的颜.,5,2021-02-18 18:00,2,"{'fixed': [{'id': 1, 'name': '购票好评'}, {'id': 4, 'name': '购票'}]}"
遵义,非常好看，推荐大家去,null,jym155009894,5,2021-02-18 18:00,2,"{'fixed': [{'id': 1, 'name': '购票好评'}, {'id': 4, 'name': '购票'}]}"
中牟,你有你们，我有我们.,2,茶笙.,5,2021-02-18 17:59,2,"{'fixed': [{'id': 1, 'name': '购票好评'}, {'id': 4, 'name': '购票'}]}"
昆明,还行吧，剧情有点凌乱,1,邺子道坤,4,2021-02-18 17:59,2,"{'fixed': [{'id': 1, 'name': '购票好评'}, {'id': 4, 'name': '购票'}]}"
新乡,期待第四部😍,null,yAG221845593,5,2021-02-18 17:59,1,"{'fixed': [{'id': 1, 'name': '购票好评'}, {'id': 4, 'name': '购票'}]}"
沈阳,不会写影评，就是觉得整体很ok，笑点基本都爆了，破案虽然我都看不太懂（没有那个头脑），但是也看进去了，印象深刻起鸡皮疙瘩头皮发麻的点很多，最深刻的还是龙Q馆，是无论已经听音乐在脑海里想象多少遍看了还是会头皮发麻的程度，虽然和平精英拉胯，后面也有点提不上劲儿，但是整体来说，是部很合格的商业电影。,2,西瓜冰沙少糖x,4.5,2021-02-18 17:59,1,"{'fixed': [{'id': 1, 'name': '购票好评'}, {'id': 4, 'name': '购票'}]}"
成都,好看！！！！,2,薛洁洁的小仙女,5,2021-02-18 17:59,3,"{'fixed': [{'id': 1, 'name': '购票好评'}, {'id': 4, 'name': '购票'}]}"
遵义,太棒了！看完非常舒服,null,xBg204478275,5,2021-02-18 17:59,2,"{'fixed': [{'id': 1, 'name': '购票好评'}, {'id': 4, 'name': '购票'}]}"
广州,"棒极了
推荐",null,ckm370946837,5,2021-02-18 17:59,2,"{'fixed': [{'id': 1, 'name': '购票好评'}, {'id': 4, 'name': '购票'}]}"
吴川,好看。。。。,null,多喝开水Xx,4.5,2021-02-18 17:59,1,"{'fixed': [{'id': 1, 'name': '购票好评'}, {'id': 4, 'name': '购票'}]}"
漳州,看睡着了，王宝强太油腻。,null,Qmj284485074,2.5,2021-02-18 17:59,3,"{'fixed': [{'id': 4, 'name': '购票'}]}"
郑州,一般 没有期待这么好看,1,xingkewei,2.5,2021-02-18 17:59,2,"{'fixed': [{'id': 4, 'name': '购票'}]}"
无锡,前面有笑点 后面较啰嗦 乱 ,1,eezmy,3,2021-02-18 17:58,1,"{'fixed': [{'id': 4, 'name': '购票'}]}"
上海,好看！！！！,null,贩卖可爱xx,5,2021-02-18 17:58,2,"{'fixed': [{'id': 1, 'name': '购票好评'}, {'id': 4, 'name': '购票'}]}"
上海,好看！！！！,null,贩卖可爱xx,5,2021-02-18 17:58,2,"{'fixed': [{'id': 1, 'name': '购票好评'}, {'id': 4, 'name': '购票'}]}"
永川,好看搞笑，情节好,null,vzq605477801,4.5,2021-02-18 17:58,2,"{'fixed': [{'id': 1, 'name': '购票好评'}, {'id': 4, 'name': '购票'}]}"
抚顺,中规中矩，没有惊艳，很普通,2,lll3200,2.5,2021-02-18 17:58,0,null
内江,觉得很好看吧，个人觉得很好看,null,千玺biubiubiu,5,2021-02-18 17:58,2,"{'fixed': [{'id': 1, 'name': '购票好评'}, {'id': 4, 'name': '购票'}]}"
西安,好看，但没有那么好笑,null,EZM889142682,4,2021-02-18 17:58,2,"{'fixed': [{'id': 1, 'name': '购票好评'}, {'id': 4, 'name': '购票'}]}"
西安,唐探3秦风追逐到了东京，在诙谐荒诞的事件、场景中，试图弄清扑朔的Q谜。在案件的一次次善恶之中，完美犯罪的理念使秦风，亦正亦邪。好的人物塑造才是好的电影，期待四。,2,我要回幼儿园当学霸,4,2021-02-18 17:58,0,null
昆明,挺棒的，一直都喜欢,2,epd921373076,4.5,2021-02-18 17:58,0,null
包头,好看，还想再看一遍！,1,王晨晖123,5,2021-02-18 17:58,2,"{'fixed': [{'id': 1, 'name': '购票好评'}, {'id': 4, 'name': '购票'}]}"
新民,我觉得还可以啊，新年嘛，就图个乐呵,2,_qqzt51383741913,4.5,2021-02-18 17:58,2,"{'fixed': [{'id': 1, 'name': '购票好评'}, {'id': 4, 'name': '购票'}]}"
菏泽,挺好看的哈哈,null,有钱都是大家的,4.5,2021-02-18 17:58,2,"{'fixed': [{'id': 1, 'name': '购票好评'}, {'id': 4, 'name': '购票'}]}"
平湖,啊哈哈哈我就系皮蛋啦,null,软熊15,5,2021-02-18 17:58,1,null
西安,今天看了唐人街探案3.把悬疑，推理，搞笑，融为一体。值得推荐！,null,quZ157032469,4.5,2021-02-18 17:58,2,null
枣庄,一般，有点浮夸应付,1,网上娱乐,3.5,2021-02-18 17:58,2,"{'fixed': [{'id': 4, 'name': '购票'}]}"
苏州,一般吧，比较失望，没前两部流畅了，剧情生硬,1,Kennethtry3,2.5,2021-02-18 17:58,2,"{'fixed': [{'id': 4, 'name': '购票'}]}"
荣成,据说剧情很悬疑，观后感好评,null,季节w,5,2021-02-18 17:58,2,"{'fixed': [{'id': 1, 'name': '购票好评'}, {'id': 4, 'name': '购票'}]}"
深圳,观影的感觉不太好,1,万物生长,0.5,2021-02-18 17:58,2,"{'fixed': [{'id': 2, 'name': '购票差评'}, {'id': 4, 'name': '购票'}]}"
库尔勒,拉拉分 挺好看的,2,xxxholic21,5,2021-02-18 17:58,3,null
北京,比起唐探1，2简直不好了(●°u°●)​ 」,null,msi455456913,3,2021-02-18 17:57,2,"{'fixed': [{'id': 4, 'name': '购票'}]}"
贵阳,剧情超级有意思 特别好看 很值得大家来看 老少皆宜 宝强特别有意思,null,蔷薇Rose,5,2021-02-18 17:57,1,null
资阳,看的我打瞌睡烂片,1,夜空中最亮的星星,0.5,2021-02-18 17:57,2,"{'fixed': [{'id': 2, 'name': '购票差评'}, {'id': 4, 'name': '购票'}]}"
资阳,看的我打瞌睡烂片,1,夜空中最亮的星星,0.5,2021-02-18 17:57,2,"{'fixed': [{'id': 2, 'name': '购票差评'}, {'id': 4, 'name': '购票'}]}"
固始县,很棒，剧情有意思,null,ncW830139223,5,2021-02-18 17:57,2,null
广州,"实话实说 第一次看电影是要不断看手机想确认是几点然后想离开的冲动 以下就是我看完两个小时从头到尾的感受：
1.演技过于浮夸 王宝强的人物设定是导演的问题 完全让这个角色在电影中强行加入尴尬的自以为好笑的无厘头情节 属实让人笑不出来的同时还无比尴尬 没有掌握真正的搞笑手法不是靠强硬的演出来和拉高自己的声线
2.推理逻辑的剧情非常奇怪 没有过多的硬件证据去支撑剧情破案 强行用搞笑和天才般的推理就能直接破案 搜罗证据和破案完全上帝式视角 
3.各种的破案手法十分僵硬 和真正的探案剧本完全没有搭边 （我不如去看名侦探柯南）
4.借着主题去到东京 想要让观众又能感受日本文化 又能破案 又能喜剧 结果导演每样都想要每样都碰不到 属实是烂片 口碑滑下来也是大势所趋 观众还是十分明智的
5.不差钱可以去看",1,ROUCX,0.5,2021-02-18 17:57,2,null
深圳,推理还可以，搞笑元素太浮夸，剧情太拖，看久了有想快进的冲动。中二病尴尬癌晚期，有些片段尴尬到脚趾头能把地板扣穿。但也不能说是烂片，推理故事挺不错，剧情反转也很让人意外，就是广告植入生硬尴尬，什么烂钱都能恰，和平精英？？？这就是一群街头混混吧，游戏的初衷维护和平的立意毛都没有，摆几辆兰博基尼是为了显得很有钱？这部电影既然是贺岁片就罢了，随便看看就好了，有点失望。（强烈建议电影音效师退休，太尴尬了，什么乱七八糟的音乐都往里面放，百分之七十的尴尬都是因为音乐）,1,📎,3,2021-02-18 17:57,3,"{'fixed': [{'id': 4, 'name': '购票'}]}"
抚州,请不要带脑子看这部电影。,null,一夜笙歌。,0.5,2021-02-18 17:57,2,"{'fixed': [{'id': 2, 'name': '购票差评'}, {'id': 4, 'name': '购票'}]}"
惠阳,也没网络上说的那么差。,2,ohE767523063,5,2021-02-18 17:57,2,"{'fixed': [{'id': 1, 'name': '购票好评'}, {'id': 4, 'name': '购票'}]}"
呼和浩特,"这一部比前两部格局更大,立意更深,融入了反战主题,场面宏大!并没有网上喷的那么烂",1,诺哥02824,5,2021-02-18 17:57,3,"{'fixed': [{'id': 1, 'name': '购票好评'}, {'id': 4, 'name': '购票'}]}"
珠海,前面搞笑，探案剧情比较多，后面会哭,null,吃吃货小仙女,3.5,2021-02-18 17:57,2,"{'fixed': [{'id': 4, 'name': '购票'}]}"
安溪,全程笑点多多，值得一看,null,zHQ431950911,4.5,2021-02-18 17:56,2,"{'fixed': [{'id': 1, 'name': '购票好评'}, {'id': 4, 'name': '购票'}]}"
广州,还行，朋友一起的,1,jerrystruff185,4,2021-02-18 17:56,2,"{'fixed': [{'id': 1, 'name': '购票好评'}, {'id': 4, 'name': '购票'}]}"
北海,还行吧还可以,null,肖V亮,3.5,2021-02-18 17:56,1,"{'fixed': [{'id': 4, 'name': '购票'}]}"
宁津,没想象的好！,null,cPh902854356,2.5,2021-02-18 17:56,1,"{'fixed': [{'id': 4, 'name': '购票'}]}"
淄博,不错想再看一遍,null,sunqingbao2008,5,2021-02-18 17:56,1,"{'fixed': [{'id': 1, 'name': '购票好评'}, {'id': 4, 'name': '购票'}]}"
襄阳,真是烂 跟1和2都不是一个级别的,1,A1997733,0.5,2021-02-18 17:56,2,"{'fixed': [{'id': 2, 'name': '购票差评'}, {'id': 4, 'name': '购票'}]}"
重庆,不知道为什么这么多人黑唐探3，我看了感觉很好看，悬疑，喜剧，煽情都有。是我喜欢的那种感觉,1,路边小青蛙,5,2021-02-18 17:56,2,"{'fixed': [{'id': 1, 'name': '购票好评'}, {'id': 4, 'name': '购票'}]}"
遂宁,有许多地方逻辑不通，bug挺多。,2,葭兔,3.5,2021-02-18 17:56,1,null
开州区,感觉还可以啊 剧情非常紧凑 没有想象的不好看,null,Defeat,4.5,2021-02-18 17:56,2,"{'fixed': [{'id': 1, 'name': '购票好评'}, {'id': 4, 'name': '购票'}]}"
重庆,确实称得上春节票房冠军🏆的质量。,1,永恒的TORRES,5,2021-02-18 17:56,1,"{'fixed': [{'id': 1, 'name': '购票好评'}, {'id': 4, 'name': '购票'}]}"
莱州,我能说什么 就是好看 没了 ,2,不是渣菜是酸菜,4.5,2021-02-18 17:56,2,"{'fixed': [{'id': 1, 'name': '购票好评'}, {'id': 4, 'name': '购票'}]}"
株洲,还不错但没有惊艳到我,null,Cmhhhhiiihshsj,4.5,2021-02-18 17:56,2,"{'fixed': [{'id': 1, 'name': '购票好评'}, {'id': 4, 'name': '购票'}]}"
株洲,还不错但没有惊艳到我,null,Cmhhhhiiihshsj,4.5,2021-02-18 17:56,2,"{'fixed': [{'id': 1, 'name': '购票好评'}, {'id': 4, 'name': '购票'}]}"
辉县,还好吧，，，,1,焙伴烘焙生活馆,4.5,2021-02-18 17:56,2,"{'fixed': [{'id': 1, 'name': '购票好评'}, {'id': 4, 'name': '购票'}]}"
宜昌,挺好看的棒棒哒👍👍,null,vDP459598768,4.5,2021-02-18 17:56,2,"{'fixed': [{'id': 1, 'name': '购票好评'}, {'id': 4, 'name': '购票'}]}"
贵阳,还是不错的哦,null,baU915530894,4.5,2021-02-18 17:56,1,"{'fixed': [{'id': 1, 'name': '购票好评'}, {'id': 4, 'name': '购票'}]}"
昆明,超好看的！不知道分数怎么这么低，估计是有人故意拉分，剧情完美，可能是那些人没看懂吧，结尾是日本的一个节日，其实陈思诚导演最后是想以一个世界和平，大家一起看烟花的感觉结尾，真的，以这个意思来想这个结尾，是不是很完美，我期待唐探4，加油，唐探！,null,LucyandI,5,2021-02-18 17:56,2,"{'fixed': [{'id': 1, 'name': '购票好评'}, {'id': 4, 'name': '购票'}]}"
赤峰,很好看，完美,null,鹤归79,5,2021-02-18 17:55,2,"{'fixed': [{'id': 1, 'name': '购票好评'}, {'id': 4, 'name': '购票'}]}"
郑州,还可以吧，开心就好,null,vdD36534404,5,2021-02-18 17:55,2,"{'fixed': [{'id': 1, 'name': '购票好评'}, {'id': 4, 'name': '购票'}]}"
遵义,一般一般，世界第三,1,x小翔x,4,2021-02-18 17:55,2,"{'fixed': [{'id': 1, 'name': '购票好评'}, {'id': 4, 'name': '购票'}]}"
温州,治好了我多年的失眠，一觉到底,1,gRJ1576799,5,2021-02-18 17:55,2,null
宿州,就那么回事  前面挺搞笑的后面就无聊了,1,爷们丶雄起,4.5,2021-02-18 17:55,2,"{'fixed': [{'id': 1, 'name': '购票好评'}, {'id': 4, 'name': '购票'}]}"
贺州,所以还是会出续集吗？结局有些伤心啊！老陈不要搞这种结局啊！她没有错只是世界并不美好！,null,冰冻结,4,2021-02-18 17:55,1,"{'fixed': [{'id': 1, 'name': '购票好评'}, {'id': 4, 'name': '购票'}]}"
即墨,挺好看的。。,null,H.62448,4.5,2021-02-18 17:55,2,"{'fixed': [{'id': 1, 'name': '购票好评'}, {'id': 4, 'name': '购票'}]}"
上海,好看，太好看了,null,Uva378685039,4.5,2021-02-18 17:55,2,"{'fixed': [{'id': 1, 'name': '购票好评'}, {'id': 4, 'name': '购票'}]}"
宜宾,还是一如既往的搞笑,null,～muice～,5,2021-02-18 17:55,3,"{'fixed': [{'id': 1, 'name': '购票好评'}, {'id': 4, 'name': '购票'}]}"
大连,太好看了，影厅也很干净,null,晓楠姐姐,5,2021-02-18 17:55,1,"{'fixed': [{'id': 1, 'name': '购票好评'}, {'id': 4, 'name': '购票'}]}"
杭州,其实还可以 整体来说还是及格线上很多的水准 就是案情相比第二部没那么烧脑 太好笑了已经二刷了 而且感觉长泽雅美还有其他的日本演员演技都很好 其中医院那一段全场笑疯 总体来说没有网上那么的不堪 还是值得看的吧 就是票价有点小贵 心疼我的钱了哈哈哈哈,1,pmR917954528,4,2021-02-18 17:55,2,"{'fixed': [{'id': 1, 'name': '购票好评'}, {'id': 4, 'name': '购票'}]}"
玉田县,不要信网络的差评！过年的合家欢电影最适合了！！嘻嘻哈哈 挺好的！！,null,WBQ120979546,5,2021-02-18 17:55,3,"{'fixed': [{'id': 1, 'name': '购票好评'}, {'id': 4, 'name': '购票'}]}"
抚顺,很棒，感人看了以后不想走,1,xiaoguangbai,5,2021-02-18 17:55,2,"{'fixed': [{'id': 1, 'name': '购票好评'}, {'id': 4, 'name': '购票'}]}"
广州,"用工会的赠票换的，幸好没花钱看哈哈，看完只觉得怪不得路人口碑差。幸好没带老妈来。
没看过1.2，只看过出圈的刘昊然护士装cos和张子枫的吓人笑容。
开头机场长镜头没啥必要，王宝强low梗多（大痔疮、36D、好胸配老歌、东京热）实在无语，有点油腻反胃，看到有人说他的观后感就是王宝强在船上吐哈哈哈。
想看刘昊然内心挣扎，结果村田昭是自己掉下去的。。。
游艇美女那里居然是克拉拉，最近电影经常出现，身材真的很好羡慕了
Q是一堆人，惊现华仔
片尾母女都很温柔坚韧的感觉，心疼啊。",null,卖白菜的老阿姨,2,2021-02-18 17:54,3,null
卢氏县,还不错，剧情来讲还是能接受，除了一直接受不了的宝强的表情过于夸张，还有……算了也许真有那种牛逼人物呢。,1,柒叔,3.5,2021-02-18 17:54,2,"{'fixed': [{'id': 4, 'name': '购票'}]}"
綦江,好看是好看，有点平平淡淡,null,sAF963942741,5,2021-02-18 17:54,1,"{'fixed': [{'id': 1, 'name': '购票好评'}, {'id': 4, 'name': '购票'}]}"
广州,没有前面的好看,null,Tttttzzzz,2.5,2021-02-18 17:54,1,"{'fixed': [{'id': 4, 'name': '购票'}]}"
南宁,广告植入太太太尴尬了，KIKO的镜头也好少,2,山鬼,3,2021-02-18 17:54,2,null
大石桥,当你长大了想用你的爱回报父母时候却发现已失去回报的机会。子欲孝，亲不待，珍惜当下！,null,郝鑫0000,5,2021-02-18 17:54,2,"{'fixed': [{'id': 1, 'name': '购票好评'}, {'id': 4, 'name': '购票'}]}"
徐州,挺好看的，除了有几个剧情有点低俗外，其他都挺好的。,2,qQR845047129,4,2021-02-18 17:54,1,null
铜梁,还行吧，不过也就当喜剧片看看。,null,好了好了我知道了,4.5,2021-02-18 17:54,2,"{'fixed': [{'id': 1, 'name': '购票好评'}, {'id': 4, 'name': '购票'}]}"
北京,没有想象中失望 质量一点没下降 请大家不要听信网上那些不实的言论 只有自己看过了才知道 肯本没有失望 甚至很精彩,2,Crazy_June,5,2021-02-18 17:54,3,"{'fixed': [{'id': 1, 'name': '购票好评'}, {'id': 4, 'name': '购票'}]}"
赣榆,最后的剧情一般般,1,港城明哥,4,2021-02-18 17:54,1,"{'fixed': [{'id': 1, 'name': '购票好评'}, {'id': 4, 'name': '购票'}]}"
温州,还行吧，看完就忘记内容了，就记得广告植入的很硬,1,NUFREE,3.5,2021-02-18 17:54,3,"{'fixed': [{'id': 4, 'name': '购票'}]}"
昆明,比起前两部差多了，不想评价 ,null,aRM167435569,4,2021-02-18 17:54,2,null
延边, 相比前俩部差那么一点吧  结尾白扯,null,黑米哥各,3,2021-02-18 17:54,3,"{'fixed': [{'id': 4, 'name': '购票'}]}"
广州,还可以，不过不要再拍第四回了，不然就太多了没有了新鲜感了。,null,BsN825282394,3.5,2021-02-18 17:54,2,"{'fixed': [{'id': 4, 'name': '购票'}]}"
临邑,这部电影真的很棒，笑点十足，完全没有网上的人说的那样烂片，值得一看,null,虔诚1145,5,2021-02-18 17:54,2,"{'fixed': [{'id': 1, 'name': '购票好评'}, {'id': 4, 'name': '购票'}]}"
南宁,还行吧 毕竟第三部了,2,可我饿啊,3.5,2021-02-18 17:53,1,"{'fixed': [{'id': 4, 'name': '购票'}]}"
深泽县,和心爱的人一起看,null,gPT918596064,4.5,2021-02-18 17:53,2,"{'fixed': [{'id': 1, 'name': '购票好评'}, {'id': 4, 'name': '购票'}]}"
重庆,好看，精彩漂亮,2,珠圆昱润,5,2021-02-18 17:53,1,"{'fixed': [{'id': 1, 'name': '购票好评'}, {'id': 4, 'name': '购票'}]}"
民权,挺好的。。。,null,SSd475611417,5,2021-02-18 17:53,1,"{'fixed': [{'id': 1, 'name': '购票好评'}, {'id': 4, 'name': '购票'}]}"
许昌,感觉就是大杂烩。没有期待中的满意。,null,hrxwan,3.5,2021-02-18 17:53,2,"{'fixed': [{'id': 4, 'name': '购票'}]}"
长春,好看有时间在去,null,jLS100497149,4.5,2021-02-18 17:53,3,"{'fixed': [{'id': 1, 'name': '购票好评'}, {'id': 4, 'name': '购票'}]}"
资兴市,是真的很好笑 但是推理部分略微弱 广告植入很生硬 但是总体观感不戳,2,眉雾山别,3.5,2021-02-18 17:53,2,"{'fixed': [{'id': 4, 'name': '购票'}]}"
资兴市,是真的很好笑 但是推理部分略微弱 广告植入很生硬 但是总体观感不戳,2,眉雾山别,3.5,2021-02-18 17:53,2,"{'fixed': [{'id': 4, 'name': '购票'}]}"
大邑,挺好的 就是结尾有点仓促,1,狂弎,4,2021-02-18 17:53,3,"{'fixed': [{'id': 1, 'name': '购票好评'}, {'id': 4, 'name': '购票'}]}"
锦州,不错，宝强逗死,null,凌辰2019,4.5,2021-02-18 17:53,1,"{'fixed': [{'id': 1, 'name': '购票好评'}, {'id': 4, 'name': '购票'}]}"
香河,还可以！！！,1,菜籽哥kevin,3.5,2021-02-18 17:53,1,"{'fixed': [{'id': 4, 'name': '购票'}]}"
连江,值得一看，全程在欢乐中看完，剧情逻辑思维都特别不错！,1,厚德先生,5,2021-02-18 17:53,1,null
郑州,没有想象中那么差,null,hGA786236777,3.5,2021-02-18 17:53,2,"{'fixed': [{'id': 4, 'name': '购票'}]}"
顺德,挺好看的，，,2,宣宝宝ZZ,5,2021-02-18 17:53,2,"{'fixed': [{'id': 1, 'name': '购票好评'}, {'id': 4, 'name': '购票'}]}"
曹妃甸,没想象的好看,null,yCr45297510,3,2021-02-18 17:53,2,"{'fixed': [{'id': 4, 'name': '购票'}]}"
罗源县,推理性不如前两部那么强，但是整部影片融合了其他新的元素，算是为第四部打基础吧。还是很值得一看到,1,qHONGJ,5,2021-02-18 17:53,2,"{'fixed': [{'id': 1, 'name': '购票好评'}, {'id': 4, 'name': '购票'}]}"
开州区,还可以就是有一些生硬植入情节不是很合理,null,daO960144725,4,2021-02-18 17:53,2,"{'fixed': [{'id': 1, 'name': '购票好评'}, {'id': 4, 'name': '购票'}]}"
合肥,剧情乱，人物杂，很牵强的情节，很牵强的搞笑,null,Hello，Monica,2.5,2021-02-18 17:53,2,"{'fixed': [{'id': 4, 'name': '购票'}]}"
宁乡,前面还不错。,null,我是金狗,4,2021-02-18 17:52,2,"{'fixed': [{'id': 1, 'name': '购票好评'}, {'id': 4, 'name': '购票'}]}"
海口,虽然很多人说是烂片，但是我个人还是觉得不错的，大概是我对侦探题材不太熟悉，所以直到最后才猜出凶手恍然大悟。除了游戏那里感觉太尬了，其他的还好吧。为评分贡献我小小的力量……希望有续集！每年大年初一能看昊然一眼是我最大的心愿（之一）了！,null,加了个六,5,2021-02-18 17:52,2,"{'fixed': [{'id': 1, 'name': '购票好评'}, {'id': 4, 'name': '购票'}]}"
上海,画面一如之前系列的精美，音乐搭配的比较适合，但有些地方搭配时间点可以更好，故事逻辑也很严谨，最后反转挺出人意料，整体质量上乘,1,地里的青蚂蚱,4.5,2021-02-18 17:52,3,"{'fixed': [{'id': 1, 'name': '购票好评'}, {'id': 4, 'name': '购票'}]}"
九江,总体还行😁,null,aGY705863039,4.5,2021-02-18 17:52,1,"{'fixed': [{'id': 1, 'name': '购票好评'}, {'id': 4, 'name': '购票'}]}"
重庆,"一直爆笑的剧情
",2,喵了个呜,4.5,2021-02-18 17:52,3,"{'fixed': [{'id': 1, 'name': '购票好评'}, {'id': 4, 'name': '购票'}]}"
郑州,好看 很好看 推荐值得去看,2,Lovelybaby1208,4.5,2021-02-18 17:52,2,"{'fixed': [{'id': 1, 'name': '购票好评'}, {'id': 4, 'name': '购票'}]}"
汉中,真的很好看啊,2,leleA3tr,5,2021-02-18 17:52,3,"{'fixed': [{'id': 1, 'name': '购票好评'}, {'id': 4, 'name': '购票'}]}"
许昌,每一部都不会让人失望，黄金搭档就属王宝强，刘昊然,null,化小云,5,2021-02-18 17:51,2,"{'fixed': [{'id': 1, 'name': '购票好评'}, {'id': 4, 'name': '购票'}]}"
南宁,就是十分，因为太多恶评,2,apY260624132,5,2021-02-18 17:51,1,null
汉中,真的很好看啊,2,leleA3tr,5,2021-02-18 17:52,3,"{'fixed': [{'id': 1, 'name': '购票好评'}, {'id': 4, 'name': '购票'}]}"
许昌,每一部都不会让人失望，黄金搭档就属王宝强，刘昊然,null,化小云,5,2021-02-18 17:51,2,"{'fixed': [{'id': 1, 'name': '购票好评'}, {'id': 4, 'name': '购票'}]}"
南宁,就是十分，因为太多恶评,2,apY260624132,5,2021-02-18 17:51,1,null
郑州,没有自己想的那么惊艳吧，唉，有点失望,null,是你的宝贝儿吖,2.5,2021-02-18 17:51,2,"{'fixed': [{'id': 4, 'name': '购票'}]}"
包头,看剧情的话，剧情紧凑，故事情节较好这次也给出了杀人案的结局。但是植入太过尴尬，东鹏特饮的前面有一点带入不太尴尬，和平精英就太尴尬了吧。尤其是大吉大利，直接带入太过于生硬。,null,无比可爱愔嫕,3.5,2021-02-18 17:51,2,"{'fixed': [{'id': 4, 'name': '购票'}]}"
广安,期待太高，前面好笑,1,嘿-那,4.5,2021-02-18 17:51,2,"{'fixed': [{'id': 1, 'name': '购票好评'}, {'id': 4, 'name': '购票'}]}"
青岛,没那么差也没很好,null,cindiii,4,2021-02-18 17:51,1,"{'fixed': [{'id': 1, 'name': '购票好评'}, {'id': 4, 'name': '购票'}]}"
佛山,无聊，低俗，笑点低，尴尬（︶︿︶）=凸,null,xYc250110219,0.5,2021-02-18 17:51,3,"{'fixed': [{'id': 2, 'name': '购票差评'}, {'id': 4, 'name': '购票'}]}"
万荣,通通都是这样,null,STl474351796,5,2021-02-18 17:50,2,"{'fixed': [{'id': 1, 'name': '购票好评'}, {'id': 4, 'name': '购票'}]}"
天长,还可以，推理部分比前两部少了些，总体还是不错的,null,ElN897995928,5,2021-02-18 17:50,1,"{'fixed': [{'id': 1, 'name': '购票好评'}, {'id': 4, 'name': '购票'}]}"
烟台,故事中有欢乐有忧伤,null,OPy324346870,4.5,2021-02-18 17:50,1,"{'fixed': [{'id': 1, 'name': '购票好评'}, {'id': 4, 'name': '购票'}]}"
南京,剧情就像流水账，包袱抖得也不好，看完想了半天真没发现有什么特别亮眼的点，很失望！这到底是一部什么样的电影？,null,李治,0.5,2021-02-18 17:50,2,"{'fixed': [{'id': 2, 'name': '购票差评'}, {'id': 4, 'name': '购票'}]}"
保定,前面好看后面无聊,null,Auo655336017,4.5,2021-02-18 17:50,2,"{'fixed': [{'id': 1, 'name': '购票好评'}, {'id': 4, 'name': '购票'}]}"
丰城,很好看建议大家来看,1,Bn丶三岁星,5,2021-02-18 17:50,2,"{'fixed': [{'id': 1, 'name': '购票好评'}, {'id': 4, 'name': '购票'}]}"
郑州,"非常喜欢这一类的电影，独自去看也很爽歪歪啊！
",2,不多说,5,2021-02-18 17:50,2,null
滦南,太好看啦！剧情设计的非常巧妙，一环扣一环，环环相扣。探案的过程不仅仅是探索真相的过程，更是各种各样人性显露的过程。世界上没有绝对的善与恶，一切都是善恶缠绕交织在一起的最终结果。一桩桩案件的背后皆有因果。真相揭开以后，只能令人唏嘘感叹。很高兴秦风能够一直坚守本心，这个世界上只有像秦风这样的人坚守下去，做自己认为对的事情，这个世界才会变的越来越好。剧情精彩曲折，出人意料又在情理之中，给人惊喜。全程基本无尿点，有搞笑也有感悟。是一部非常好的电影，没有辜负我等了这么久！,null,Qhl774070745,5,2021-02-18 17:50,2,"{'fixed': [{'id': 1, 'name': '购票好评'}, {'id': 4, 'name': '购票'}]}"
宁波,还可以，挺好笑的,2,诸褚褚,4.5,2021-02-18 17:50,1,"{'fixed': [{'id': 1, 'name': '购票好评'}, {'id': 4, 'name': '购票'}]}"
三亚,好好看  喜欢,1,哎哟～不错哦923,5,2021-02-18 17:49,2,"{'fixed': [{'id': 1, 'name': '购票好评'}, {'id': 4, 'name': '购票'}]}"
